{
  "id": "build-review-quick",
  "name": "Build-Review Quick",
  "description": "Low-scrutiny iterative build-review loop. A lightweight review pass ensures basic correctness before delivery. Suited for low-risk or well-understood changes.",
  "nodes": {
    "start": {
      "type": "start",
      "name": "Start",
      "description": "Build-review cycle begins"
    },
    "build": {
      "type": "task",
      "name": "Build",
      "description": "Implement or revise the changes based on requirements or review feedback",
      "agent": "Developer",
      "stage": "development"
    },
    "review": {
      "type": "gate",
      "name": "Quick Review",
      "description": "Lightweight review checking basic correctness and completeness",
      "agent": "Reviewer",
      "stage": "verification",
      "maxRetries": 2,
      "config": {
        "scrutinyLevel": 1
      }
    },
    "lint_format": {
      "type": "gate",
      "name": "Lint & Format",
      "description": "Run lint and format checks. Auto-fix issues where possible.",
      "agent": "Developer",
      "stage": "delivery",
      "maxRetries": 3
    },
    "commit": {
      "type": "task",
      "name": "Commit Changes",
      "description": "Commit all changes with a descriptive message summarizing the work done",
      "agent": "Developer",
      "stage": "delivery"
    },
    "end_success": {
      "type": "end",
      "result": "success",
      "name": "Complete",
      "description": "Build passed review and delivered"
    },
    "hitl_blocked": {
      "type": "end",
      "result": "blocked",
      "escalation": "hitl",
      "name": "Blocked",
      "description": "Build failed review after all retries - needs human intervention"
    }
  },
  "edges": [
    {
      "from": "start",
      "to": "build"
    },
    {
      "from": "build",
      "to": "review"
    },
    {
      "from": "review",
      "to": "build",
      "on": "failed",
      "label": "Revise build based on review feedback"
    },
    {
      "from": "review",
      "to": "hitl_blocked",
      "on": "failed",
      "label": "Review failures exhausted retries"
    },
    {
      "from": "review",
      "to": "lint_format",
      "on": "passed",
      "label": "Review passed, run lint checks"
    },
    {
      "from": "lint_format",
      "to": "commit",
      "on": "passed",
      "label": "Lint passes, commit changes"
    },
    {
      "from": "lint_format",
      "to": "build",
      "on": "failed",
      "label": "Fix lint/format issues"
    },
    {
      "from": "lint_format",
      "to": "hitl_blocked",
      "on": "failed",
      "label": "Lint issues persist"
    },
    {
      "from": "commit",
      "to": "end_success"
    }
  ]
}
